{"schemaVersion":"FLR_V41_CAPTURED_BOUNDARY_1.0","incidentId":"INC-FORWARD-LAYER-ABANDONMENT","sourceHead":"b4777768f41ee252ba38ecfa84a01fc8409fb182","scenario":"CROSS_LEFT","seed":"FINAL-MATCH-TEST-77","startState":{"ballOwner":"WIDE"},"observable":{"ball":{"x":72,"y":8,"mode":"LIVE"},"threat":{"id":"ST-1","role":"ST","distance":8,"reachableTime":0.9,"immediacy":"HIGH"},"defender":{"id":"RB-1","role":"RB","distanceToThreat":10,"reachableTime":0.8},"responsibility":{"ownerId":"CB-1","reason":"HELP_CENTRAL_ST","coverOrHandoff":true},"centralSupport":{"count":1}},"resultStatus":"CONTROL_REPRODUCTION"}
